{
  "schema_version": 1,
  "locale": "en",
  "language_name": "English",
  "direction": "ltr",
  "status": "source",
  "strings": {
    "artifact_agenda": "Agenda",
    "artifact_agenda_packet": "Agenda packet",
    "artifact_audio": "Audio",
    "artifact_detail": "Meeting details",
    "artifact_minutes": "Minutes",
    "artifact_public_comment": "Public comment",
    "artifact_transcript": "Transcript",
    "artifact_video": "Video",
    "back_to_home": "Home",
    "breadcrumbs": "Breadcrumbs",
    "project_name": "{{PROJECT_NAME}}",
    "project_description": "A public-meeting library for {{COUNTRY_NAME}}.",
    "browse_jurisdictions": "Browse jurisdictions",
    "child_jurisdictions": "Places within this jurisdiction",
    "coverage_summary": "Current library coverage",
    "governing_bodies": "Governing bodies and meetings",
    "governing_bodies_count": "Governing bodies",
    "jurisdiction": "Jurisdiction",
    "jurisdictions_count": "Jurisdictions",
    "languages": "Languages",
    "latest_meetings": "Latest meetings",
    "meetings_count": "Meetings",
    "no_governing_bodies": "No verified governing bodies are published here yet.",
    "no_jurisdictions": "No verified jurisdictions are published here yet.",
    "source_record": "View the source record",
    "publication_pending": "Awaiting human review",
    "no_meetings_found": "No verified meetings are published here yet.",
    "status_cancelled": "Cancelled",
    "status_completed": "Completed",
    "status_scheduled": "Scheduled",
    "status_unknown": "Status not confirmed"
  },
  "review": {
    "method": "human",
    "notes": "English source locale supplied by the Respawn Kernel."
  }
}
